{
  "schema_version": "decentralized-forge.live-evidence-index.v1",
  "loop": 74,
  "created_at": "2026-06-29",
  "purpose": "Secret-free index of narrow live/local evidence that can be rendered without upgrading unverified protocol claims.",
  "claim_policy": {
    "contains_secret_values": false,
    "allowed_claims": [
      "Radicle local CLI verified for one disposable private temporary-RAD_HOME init/inspect replay",
      "Nostr selected-relay acceptance/readback verified for one exact prototype event on two relays",
      "Radicle disposable public seed/remote-clone smoke verified for exact RID rad:z2WtozFrCRhygh9CGzyUN57CN7Nwa",
      "GitHub Actions generated keyless hosted artifact attestations for six prototype artifacts on main",
      "Helia local UnixFS/IPFS add-get verified for the local release artifact fixture bytes",
      "Public gateway preflight queried three gateways and observed no successful readback for the unpinned fixture CID",
      "Nostr selected-relay issue/patch acceptance/readback verified for two disposable prototype events",
      "Radicle broader check recorded current-host rad CLI absence plus read-only public route probes",
      "Registry-shaped keyless attestation import recorded outside project-registry fixtures",
      "Current decentralized-forge commit initialized as a public Radicle repo and cloned/read back from a separate temporary profile",
      "Recorded Radicle RID cloned/read back from a fresh temporary Radicle profile without reusing the original Loop 59 seed profile",
      "Current project commit published to the recorded Radicle RID under a fresh peer namespace, while default readback remained on the original delegate commit",
      "Retained project-scoped Radicle maintainer state published a new RID and fresh default plus direct-seed readbacks matched the source commit",
      "The same retained Radicle RID advanced from the Loop 62 commit to the next Git commit, with fresh direct-seed readback matching the updated commit",
      "The same retained Radicle RID advanced to the current published commit, a fresh reader cloned from the retained seed, and a second fresh reader cloned from that first reader acting as a follower seed",
      "The same retained Radicle RID advanced to the current published commit, a fresh reader cloned from the retained seed before restart, and another fresh reader cloned from the retained seed after restart on the same local address",
      "A public VPS follower seed served the retained Radicle RID to a fresh reader from a separate Linux machine, and readback matched the expected commit",
      "The public openclaw VPS follower seed runs as an enabled user-level systemd service and served the retained RID after an explicit service restart",
      "A repeatable public Radicle seed health-check script cloned the retained RID from the explicit openclaw seed and verified the expected commit",
      "The retained RID advanced to commit 64efbada294d4a57c014a27398b92e344c6d68aa and the public openclaw follower seed served that updated commit to a fresh reader",
      "An external ubuntu-work user systemd timer ran the public Radicle seed health check and wrote a passing latest.json for the openclaw seed",
      "The retained RID advanced to commit ef16e2ad39d3e13bdcc9d454443c5bbb17733c68 and the public openclaw follower seed served that updated commit to a fresh reader",
      "A second persistent follower seed on ubuntu-work served the retained RID to a fresh reader on openclaw over Tailnet, with readback matching commit ef16e2ad39d3e13bdcc9d454443c5bbb17733c68",
      "The ubuntu-work follower seed is reachable through a second public openclaw relay address, and a fresh ubuntu-work reader connected to z6MksRdjzuN2VYV4HTXdVSchitJ8Bq1zbx8WhBb3KhyfSm6A@187.77.19.162:8877, cloned the retained RID, and verified commit ef16e2ad39d3e13bdcc9d454443c5bbb17733c68"
    ],
    "forbidden_claims": [
      "Radicle durable public seed/network availability verified",
      "Nostr durability or global propagation verified",
      "censorship resistance verified",
      "identity trust verified",
      "production readiness verified",
      "full NIP-34 or forge compatibility verified",
      "security guarantees verified"
    ]
  },
  "evidence": [
    {
      "id": "loop23-radicle-local-cli-replay",
      "protocol": "radicle",
      "scope": "radicle.local_cli_private_replay",
      "state": "local-cli-verified",
      "verified_at": "2026-06-22",
      "evidence_file": "evidence/radicle-local-replay-2026-06-22.md",
      "evidence_sha256": "c625ba4e8173395496b69f3c15f1c22b9f48770ddd57b9da7c14afbae039b1ae",
      "evidence_size_bytes": 5907,
      "verification_summary": "Temporary RAD_HOME plus disposable Git repository completed rad auth, private no-seed rad init, and local rad inspect commands.",
      "live_network_action": false,
      "local_cli_verified": true,
      "selected_relay_readback_verified": false,
      "synthetic": false,
      "public_identifiers": {
        "rid": "rad:z33oByNZxkxXAChhD54B4XiSsQkao",
        "delegate_did": "did:key:z6MkutM4LWh4y9qdeSMTWW88pMDVJBBhnjkoGPgZq1aSYN2n",
        "visibility": "private",
        "disposable_git_commit": "dfa5aad01c1bad5d2b1cda9919251b41e14ee643"
      },
      "non_claims": [
        "no Radicle node start",
        "no rad publish",
        "no public seed publication",
        "no sync or announce",
        "no remote peer configuration",
        "no public network replication verification",
        "no durability or censorship-resistance claim",
        "no production-readiness claim"
      ],
      "notes": "Promotes only the disposable private local replay path. Later Loop 34 evidence separately records one bounded disposable public seed/clone smoke; this row does not imply public-network availability."
    },
    {
      "id": "loop25-nostr-selected-relay-readback",
      "protocol": "nostr",
      "scope": "nostr.selected_relay_publish_readback",
      "state": "selected-relay-readback-verified",
      "verified_at": "2026-06-22",
      "evidence_file": "evidence/nostr-loop25-publish-readback-2026-06-22.json",
      "evidence_sha256": "956088edcbee064dc0a353745baa5e3aefb7dd9e2d6523415b3d57ae53b06f31",
      "evidence_size_bytes": 11698,
      "verification_summary": "Exact prototype/research kind 30617 event was published to and read back from selected relays; local and readback nak verify returned exit code 0.",
      "live_network_action": true,
      "local_cli_verified": true,
      "selected_relay_readback_verified": true,
      "synthetic": false,
      "public_identifiers": {
        "event_id": "4cd841ac7d3c15c3e2a0ab1e65b5d704b7032adea2d7dcd171ab613657d48eba",
        "pubkey": "6669423ee76d9d5adc8e81df79286c2569edbe5ab84f3e35043db71a54eff5c8",
        "kind": 30617,
        "relays": [
          "wss://relay.damus.io",
          "wss://nos.lol"
        ]
      },
      "non_claims": [
        "not a durability guarantee",
        "not proof of global propagation",
        "not proof of censorship resistance",
        "not proof of identity trust",
        "not production readiness",
        "not full NIP-34 or forge protocol compatibility",
        "not a security guarantee"
      ],
      "notes": "Uses only the disposable project key; secret key material remains outside the repo and is not recorded here."
    },
    {
      "id": "loop34-radicle-disposable-public-smoke",
      "protocol": "radicle",
      "scope": "radicle.disposable_public_seed_clone_smoke",
      "state": "disposable-public-smoke-verified",
      "verified_at": "2026-06-22",
      "evidence_file": "evidence/radicle-public-network-smoke-2026-06-22.json",
      "evidence_sha256": "0300867c473c099e103674633dbe8b3c77b78cfcd9fb2e119bec9ebce3e6cf93",
      "evidence_size_bytes": 19408,
      "verification_summary": "One disposable public Radicle repository was initialized, seeded from a temporary localhost node, synced/announced, cloned through a separate temporary node, and read back successfully.",
      "live_network_action": true,
      "local_cli_verified": true,
      "selected_relay_readback_verified": false,
      "synthetic": false,
      "public_identifiers": {
        "rid": "rad:z2WtozFrCRhygh9CGzyUN57CN7Nwa",
        "visibility": "public",
        "seed_scope": "temporary localhost seed node",
        "clone_scope": "separate temporary Radicle profile/node"
      },
      "non_claims": [
        "not proof of durability",
        "not proof of censorship resistance",
        "not a security guarantee",
        "not proof of global replication",
        "not proof of identity trust",
        "not production readiness",
        "not full Radicle compatibility",
        "not proof of broad Radicle network availability"
      ],
      "notes": "Uses only disposable temporary state recorded in Loop 34 evidence. No production/private personal keys, paid infrastructure, direct outreach, persistent seed operation, or broad network availability claim."
    },
    {
      "id": "loop40-github-keyless-artifact-attestation",
      "protocol": "github-actions",
      "scope": "ci.keyless_artifact_attestation",
      "state": "hosted-keyless-attestation-generated",
      "verified_at": "2026-06-28",
      "evidence_file": "evidence/github-keyless-attestation-2026-06-28.json",
      "evidence_sha256": "c03a1dfe1103686a3a5a1cdcd13f82ac24ee962a8dffc265c3f5ed05fd8f3019",
      "evidence_size_bytes": 3158,
      "verification_summary": "GitHub Actions run 28339280081 generated a keyless hosted attestation with SLSA provenance predicate for six prototype artifacts after CI passed on main.",
      "live_network_action": true,
      "local_cli_verified": false,
      "selected_relay_readback_verified": false,
      "synthetic": false,
      "public_identifiers": {
        "workflow_run": "https://github.com/redclawanon-rgb/decentralized-forge/actions/runs/28339280081",